{"demoLabel":"Demo data — not VT Infinite's financial records.","entityId":"demo","environment":"synthetic-demo","exceptions":[{"description":"Synthetic exception: the 2000-03-10 transfer into reserve cash has not been matched to a synthetic bank statement.","exceptionId":"syn-exc-001","kind":"unreconciled-item","openedDate":"2000-04-03","ownerRole":"Synthetic role: accounting reconciler","resolutionRef":null,"scope":"Reserve cash, 2000-Q1 (synthetic).","status":"open"}],"periodId":"2000-Q1","schema":"marrs-rover.exceptions.1"}